{
  "request_id": "8f2b1e0c-4d5a-4b91-9c3e-6a7f0d2b5c41",
  "served_model": "gemini-3.8-flash",
  "requested_model": "claude-opus-5",
  "routed": true,
  "cost_usd": 0.003281,
  "savings_usd": 0.018594,
  "priced": true,
  "baseline_model": "claude-opus-5",
  "baseline_reason": "named",
  "baseline_cost_usd": 0.021875
}
